,Headlines,Source,Author,Date,Link,Content,Quotes
36,Beard Discusses “Frustrating” Draw Against Reading,SB Nation,Mari Lewis,2022-11-25,https://liverpooloffside.sbnation.com/2022/11/25/23477794/beard-discusses-frustrating-draw-against-reading,"We use cookies and other tracking technologies to improve your browsing experience on our site, show personalized content and targeted ads, analyze site traffic, and understand where our audiences come from. To learn more or opt-out, read our Cookie Policy. Please also read our Privacy Notice and Terms of Use, which became effective December 20, 2019.By choosing I Accept, you consent to our use of cookies and other tracking technologies.Filed under:Liverpool Women could have hoped for moreIf you buy something from an SB Nation link, Vox Media may earn a commission. See our ethics statement.Liverpool FC Women dropped points late Thursday against struggling Reading, who came from behind to equalize in stoppage time. The Reds had gone up early, but had to come from behind in the second half to go into second half stoppage time 3-2 up. Conceding so late was “frustrating” for manager Matt Beard, who believed his team “should have been out of sight.”At the end of the day, the draw was another performance where the result belied the overall quality of play. Reading held the Reds to just one goal in the first half despite Liverpool’s productive chance creation. At the end of the match, Reading had pulled equal, with 17 shots (seven on target) to Liverpool’s 16 shots — and the Reds will be disappointing that they managed to put just a quarter of these shots on target.Speaking postmatch, Beard gave voice to the side’s disappointment speaking to Liverpoolfc.com:We are frustrated not to get all three points, especially after we went back in front and then conceding in the 88th minute.“Crosses and set-pieces were a problem for us tonight and we knew Reading are dangerous from them, so that was super-disappointing.“I was really pleased with the character after going 2-1 down and then getting back in front, but obviously we are frustrated we have not managed to see the game out and take all three points.“It is an important point on the road, but I thought we should have been out of sight with the chances we had in the first half, being perfectly honest with you.”Of course, the Reds will be targeting simply staying up this season, their first back in the Women’s Super League. It is certainly important to take these frustrating results with that goal in mind: Liverpool currently sit five points above the relegation spot, and are in 10th. Beard is confident that his side should have enough to stay up and to improve their position, particularly in the present context:“It’s a tough league and we feel we have the quality in this squad to stay in this division. “It’s tough to pick up points away from home in this league and we have had two long journeys in four days, so another point on board was vitally important.“We have got two games at home now in the WSL and we need to try to take maximum points against West Ham United and Leicester City.“We want to consolidate and keep moving forward so as long as we keep creating chances like we did tonight then I’m confident we will be OK.”Check your inbox for a welcome email.Oops. Something went wrong. Please enter a valid email and try again.* 21+ (19+ CA-ONT) (18+ NH/WY). AZ, CO, CT, IL, IN, IA, KS, LA, (select parishes), MD, MI, NH, NJ, NY, OR, PA, TN, VA, WV, WY, CA-ONT only.Eligibility restrictions apply. Terms at draftkings.com/sportsbook. Gambling problem? Call 1-800-GAMBLER. Odds & lines subject to change.",[]
37,"Aston Villa v Arsenal Women: preview, what to watch for, how to watch",SB Nation,Aidan Gibson,2022-12-11,https://theshortfuse.sbnation.com/2022/12/10/23503430/aston-villa-v-arsenal-women-wsl-preview-what-to-watch-for-how-to-watch,"We use cookies and other tracking technologies to improve your browsing experience on our site, show personalized content and targeted ads, analyze site traffic, and understand where our audiences come from. To learn more or opt-out, read our Cookie Policy. Please also read our Privacy Notice and Terms of Use, which became effective December 20, 2019.By choosing I Accept, you consent to our use of cookies and other tracking technologies.Filed under:Arsenal travel to Birmingham for their final WSL game of 2022. Arsenal Women play their final WSL game of 2022, as they travel to the Midlands to face 5th placed Aston Villa at Villa Park. Here are three things to watch for. Rachel Daly was Aston Villa’s big summer signing, and one who has put Villa at the top of the rest of the WSL. Broadly speaking, the midtable of the WSL have teams that are well-organized and have a good defensive shape. The big difference between Aston Villa, Tottenham, and Everton is that Aston Villa have a striker who scores goals. Rachel Daly was often prolific in the NWSL, with Houston, and she’s the joint top scorer in the WSL this season, with 8 goals, albeit with 3 from the penalty spot. Still, 5 non-penalty goals puts her level with Sam Kerr (and Frida Maanum). Daly can drop deep to knit play, but she feasts on crosses, with service coming from Alisha Lehmann and Kirsty Hanson. Kenza Dalí joined in the summer and has added creativity to Villa’s midfield. Villa are third in the WSL in crosses into the penalty area per game, with Hanson, Lehmann and right back Sarah Mayling playing the most per game. Mayling is also Villa’s top progresser from the back. Arsenal have had a tactical rejig in recent weeks. With Beth Mead out and Lina Hurtig out, and Mana Iwabuchi not favoured, Katie McCabe has been the right winger almost by default, as soon as she wasn’t required at left back. McCabe plays as an inverted winger on the right hand side, which is contrary to how Beth Mead plays on the right. McCabe will act almost as a third central midfielder or #10, which allows Vivianne Miedema to push higher up. As a result, there’s space on the right hand side. On Wednesday, Stina Blackstenius exploited that space to set up Miedema’s winner against Juventus, with Blackstenius’ cross set up by a dink from Leah Williamson. Williamson is unlikely to start, having started midweek, but Rafaelle Souza should return. Rafaelle has the ability to play diagonals, but also plays longer passes down the wing or into the channel. Stina Blackstenius assisted Vivianne Miedema’s winner against Juventus, but she hasn’t scored in over a month for Arsenal, last netting against Leicester City. In this four match scoreless run, Blackstenius has had chances, but just hasn’t been able to convert, with an xG from the four games of 1.6. Shots haven’t been lacking; she’s taken 13, and has been somewhat unlucky, having hit the woodwork, but Arsenal will need her to find her scoring boots again. Essentially, the underlying numbers are fine, but with two crucial games after Villa, against Lyon and Zurich in the Champions League, a goal for Blackstenius would be very valuable heading into the final stretch of matches in the year. Player to watch: Laura WienroitherLaura Wienroither has wrestled the starting right back role from Noëlle Maritz, and has done nothing to cede the role. There’s a new challenge for Wienroither now, though; with McCabe ahead of her, there’s more space for Wienroither, but also more passing and creative responsibility. One thing Wienroither is very good at doing is being a direct player, including getting into the attacking and final third. With Arsenal’s switches of play, that could be a route to goal, with build-up play down the left.Predicted lineup (4231): 1. Zinsberger; 26. Wienroither, 3. Wubben-Moy, 2. Rafaelle Souza, 7. Catley; 12. Maanum, 13. Wälti; 15. McCabe, 11. Miedema, 19. Foord; 25. BlacksteniusSubstitutes: 18. Marckese, 5. Beattie, 6. Williamson, 8. Nobbs, 16. Maritz, 23. Iwabuchi, 59. Agyemang WHAT: Aston Villa Women v Arsenal Women, Women’s Super LeagueWHERE: Villa Park, BirminghamWHEN: Sunday, December 11th 8:15 AM PDT | 11:15 AM EDT | 4:15 PM GMTWATCH: Paramount+ (US, streaming), Sky Sports (UK)* 21+ (19+ CA-ONT) (18+ NH/WY). AZ, CO, CT, IL, IN, IA, KS, LA, (select parishes), MD, MI, NH, NJ, NY, OR, PA, TN, VA, WV, WY, CA-ONT only.Eligibility restrictions apply. Terms at draftkings.com/sportsbook. Gambling problem? Call 1-800-GAMBLER. Odds & lines subject to change.",[]
38,Rachel Daly's top five 2022 performances including England goals and WSL hat-tricks,Mirror Online,mirrornews@mirror.co.uk (Hannah Pinnock),2022-12-06,https://www.mirror.co.uk/sport/football/news/rachel-daly-top-five-performances-28669191,,[]
39,"Arsenal Women face gruelling December schedule, with so many injuries",Just Arsenal News,Michelle,2022-11-28,https://www.justarsenal.com/arsenal-women-face-gruelling-december-schedule-with-so-many-injuries/324635,"Gruelling December schedule for Arsenal in Women’s Super League & Champions League By MichelleOur Arsenal Women’s Team currently sit 2nd in the 2022/23 Women’s Super League table.  Our Gunners have played 7 games, winning 6 and losing only one.The games so far in the WSL were:Sept 16th     Arsenal beat Brighton & Hove Albion 4-0Sept 24th     Arsenal beat Tottenham 4-0 at Emirates, while breaking WSL attendance record.Oct 16th       Arsenal beat Reading 1-0, on tired legs but our Gunners got the job done!Oct 23rd       Arsenal beat Liverpool 2-0Oct 30th       Arsenal beat West Ham 3-1, achieving a record-breaking 13 consecutive WSL wins!Nov 6th        Arsenal beat Leicester 4-0, top of the WSL and 14 consecutive WSL wins!International Break, with many of our Gunners on international dutyNov 19th      Arsenal lost to Man Utd 2-3, end of consecutive wins & down to 2nd in the WSL..Arsenal have been devastated by injuries, significantly increasing over the last month.  When Arsenal welcomed Man Utd to Emirates stadium, with over 40,000 in attendance, boss Jonas Eidevall was already down to a choice of 16 match fit players, with Rafaelle Souza, Leah Williamson, Teyah Goldie, Captain Kim Little and Lina Hurtig all out with injuries.  Arsenal were 2-1 up against Man Utd but everything changed in injury time with Man Utd scoring two goals from set-pieces in quick succession taking the full-time score to 2-3 to Man Utd.  Also in the last seconds of injury time Arsenal & England star Beth Mead went down with a significant ACL injury, leaving Jonas with 15 players to choose from as our gunners went into their next Champions League match against Juventus, which ended with a 1-1 draw.Arsenal’s next WSL match is at Meadow Park when they will host Everton on Saturday December 3rd.  Tickets available here Everton are currently 8th in the Women’s Super League table.  Arsenal met Everton in the previous 2021/22 season where they lost one and won one game with a 2- 1 win for Everton in December 2021 then a 5-1 win for Arsenal in May 2022.Our Gunners will then welcome Juventus to Emirates Stadium on December 7th, continuing their Champions League campaign before facing Aston Villa away at Villa Park Stadium on Sunday December 11th (16:15 kick-off). Tickets available here.  Aston Villa are currently 5th in the Women’s Super League table.  Arsenal met Villa in the previous 2021/22 season where they won both games by quite a margin, with a 4-0 away win for Arsenal in October 2021 then a 7-0 home win for Arsenal in May 2022.I would like to think that Arsenal can win both matches, against Everton and Aston Villa.  But with Arsenal’s current injury list I think Aston Villa, especially with the match being played at the 42,000 seater Villa Park stadium, Arsenal Women fans might be out in force for this one!After Aston Villa, Arsenal are back in Champions League action as they host reigning champions Lyon, again at Emirates Stadium on December 15th.  They then have less than a week before they are away to Zurich on December 21st. in the last of their UEFA WCL group games..Our Arsenal Women will really need a rest after such a gruelling December schedule.Firstly what are your thoughts on Arsenal’s seemingly ever-growing injury list?Secondly, what do you think they can achieve through December with such a gruelling back to back Women’s Super League and Champions League schedule?Michelle MaxwellFollow Michelle on Just Gooner Women on Twitter for regular updates on the Arsenal Women’s Team!Do you want to read more about the Arsenal Women’s Team? Click here….",[]
40,Arsenal Debate: How should the Women handle the rapid expansion in fans and interest?,Just Arsenal News,Michelle,2022-11-22,https://www.justarsenal.com/womens-super-league-with-growing-crowds-come-growing-pains-for-arsenal-other-teams/324137,"Women’s Super League: with growing crowds come growing pains for Arsenal & other teams By MichelleThis weekend saw the Women’s Super League take the spotlight in English football, with the Premier League on international break for the 2022 World Cup in Qatar and the England team beginning their campaign on Monday lunchtime, with a 6-2 win over Iran.The WSL produced some spectacular football – Manchester United’s thrilling late comeback to defeat Arsenal 2-3 at Emirates, the fast-paced 3-3 draw between Liverpool and Brighton, and some great football as reigning WSL champions Chelsea beat Spurs 3-0.The WSL also drew in impressive crowds.  Chelsea women broke their home attendance record as they played at Stamford Bridge for the first time since 2019.  More than 40,000 supporters were at Emirates Stadium on Saturday evening as Arsenal hosted Man Utd Women.The Championship saw some good attendance too as Sheffield United Women drew a record crowd of 11,137 to Bramall Lane for their 2-0 defeat to London City Lionesses.But how do we do this on a consistent basis and turn occasional fans into dedicated supporters who follow the WSL clubs week in and week out?With growing crowds come growing pains..  Chelsea’s home, Kingsmeadow, only has a capacity of 4,850.  Arsenal usually play at Meadow Park, which can hold a capacity of 4,500.The success of the Lionesses at Euro 2022 saw interest in women’s football in England increase dramatically, but WSL teams are generally performing in their usual surroundings, which raises the question of how do we grow attendance when women’s home ground matches are already being sold-out on a regular basis?Let’s take a look at some WSL manager’s views:Arsenal faced Tottenham at the men’s ground earlier this season, winning 4-0 in September in front of a WSL record-breaking crowd of 47,367.  After the match Eidevall said It is so important for growing the game to make sure that these occasions are not one-offs.  If you’re doing that, then I think the chances increase that you can repeat it again because of course, it’s not going to be a sustainable solution to give away tickets for games.  Let’s be honest, football clubs need revenues and ticket sales are important for revenues, he added.Arsenal manager Jonas Eidevall said of the Emirates: I think it’s one of our two homes. And from the time I’ve been here, we feel more and more that this is our home.Arsenal play their home Champions League matches at Emirates Stadium this season. While these games have drawn much lower crowds, they are ensuring the women’s club game at England’s biggest stadia is becoming normal.At her post-match press conference on Sunday, Chelsea Manager Emma Hayes said: I’d like to be here [at Stamford Bridge] more.  I think we all know that solving the conundrum in the women’s game around what do we do from small stadia, is there a medium-term plan to go to medium-size stadiums before eventually everyone comes home to the large stadium?  I don’t know, but I’m absolutely certain we’re all outgrowing our small stadiums, that I’m sure of.I think one of the biggest things that perhaps we don’t talk enough about is how cheap women’s football is, Hayes said. I really believe we have to increase the overall pricing structure if we’re to play more in these places, because there is a cost implication to it.I think the audiences are there, not for every game, but certainly for maybe eight games, 12 games a year.  We have to be more ambitious for ourselves.  Is it too cheap to watch women’s football?  I think it is, especially for the top games.Arsenal & Chelsea fans adult tickets generally cost about £8 to £9.  For bigger matches such as Arsenal v Chelsea at Emirates Stadium on 15th January 2023, adult tickets are still only £12.  Tickets are available to purchase here.Reading boss Kelly Chambers, speaking before their 3-1 defeat to Aston Villa, played at Villa Park, she said: Off the back of the Euros, we knew the biggest change we wanted to see happen this year was getting more fans in the door, watching the games but not only that, grow the fanbase too.  It’s all well and good having fans turn up to the stadium every so often, but what we want is to ensure they are embedded into our experience and leave them wanting more.A big change for this weekend’s big stadium matches was away ends.  Usually WSL crowds are mixed, but on Saturday night, the Manchester United players celebrated wildly with their travelling fans.  Manager Mark Skinner said of away ends, after the Arsenal – Man Utd match: Whether it’s concrete proof or not, if you give us away ends you will get a lot of fans through the door.  Tonight was a good indicator of that. We just had to go to them at the end, it was good to know where they were.In summary, there is definitely a conundrum.. everyone wants more bums on seats for WSL games but nobody really has enough seats to put those proverbial bums on..Away ends is a given in men’s football, shouldn’t it be the case in womens – particularly for the big games at least?Ridiculously low prices need to increase, not to exorbitant levels like the men’s game but somewhere above single figures per ticket would be a marked improvement in helping to finance the women’s game.Gooners, your thoughts would be appreciated on this one..Michelle MaxwellFollow Michelle on Just Gooner Women on Twitter for regular updates on the Arsenal Women’s Team!Do you want to read more about the Arsenal Women’s Team? Click here….Great to see the game growing and becoming more inclusive. As a professional concern Arsenal should be at the forefront of maintaining high playing standards, participation rates and maintaining the Arsenal FC brand’s worldwide status.",[]
41,Arsenal lead the way as Women’s Super League attendances up by average 200%,Just Arsenal News,Michelle,2022-12-09,https://www.justarsenal.com/arsenal-lead-the-way-as/325536,"Arsenal lead the way as WSL attendances up by average 200% by MichelleKelly Simmons OBE, FA Director of the women’s professional game, speaking to the BBC prior to this weekend’s final round of WSL fixtures before the winter break, confirmed that average attendances in the Women’s Super League have increased by 200%, also adding that average attendances in the Women’s Championship are up by 85%.Interest in the women’s game has increased significantly since England won a first major women’s tournament when they beat Germany in the Euro 2022 final earlier this summer.The Lionesses’ victory propelled the women’s game in this country to new levels, said Simmons. It was important for us to capture and capitalise on that momentum.She added: It has often been said that a successful women’s England team will help generate interest in the domestic game.This is certainly true, and I have been really overwhelmed by the response we have seen from fans – new and old – in the first half of the season.I am delighted to reveal that since the season commenced, we have seen almost 300,000 spectators attend matches across the Barclays Women’s Super League.This just highlights how much appetite there is for world-class women’s league football.We are currently averaging almost 6,000 fans a week in the Barclays Women’s Super League as we go into the final league fixtures of 2022 – which is up over 200% on this time last year.The Barclays Women’s Championship is also performing brilliantly, with the average attendance up over 85% on this time last year.Arsenal’s game against Tottenham at Emirates Stadium in September set a WSL record attendance of 47,367.  Indeed, if you peruse the tables below you can see that Arsenal Women are leading the way with the top 2 spots in highest attendances this season so far..Onwards and upwards for our Gunners and the rest of the WSL teams.  This is fantastic news for women’s football as a whole.How many more of you are going to games?  Who’s been to Emirates Stadium?  And how many of you have started watching women’s football more on TV?It would be interesting to hear your thoughts..Michelle MaxwellFollow Michelle on Just Gooner Women on Twitter for regular updates on the Arsenal Women’s Team!Do you want to read more about the Arsenal Women’s Team? Click here….Your email address will not be published. Required fields are marked *Comment Name * Email *  

 Notify me of follow-up comments by email. Notify me of new posts by email.This site uses Akismet to reduce spam. Learn how your comment data is processed.",[]
