,Headlines,Source,Author,Date,Link,Content,Quotes
66,Jordan Nobbs injury update ahead of Arsenal v Man Utd Womens clash,Just Arsenal News,Michelle,2022-11-17,https://www.justarsenal.com/arsenal-womens-jordan-nobbs-injury-update-ahead-of-man-utd-clash/323621,"Injury put Arsenal’s Jordan Nobbs out of the England Women squad that faced Japan and Norway in the recent international friendlies held at Pinatar Arena in Murcia, Spain.  Jordan captained Arsenal Women to a 4-0 victory over Leicester in the Women’s Super League in Arsenal’s last WSL game before the international break.  Mana Iwabuchi came off the bench to replace Nobbs in the second half of the game, as Jordan had picked up an injury.Nobbs joined the Lionesses in Murcia for the friendlies but made the difficult decision, in consultation with Sarina Wiegman, to return to Arsenal for treatment.It was bad timing for me, Nobbs told the Evening Standard.  Jordan is back in training now and hoping to play for Arsenal this weekend when they host Manchester United at Emirates Stadium.I have just got to keep going with what comes with football. I got through a lot of injuries with mental toughness. Something like that won’t break me, but it was obviously bad timing.I was excited to be part of the squad. Sarina [Wiegman] was amazing with the situation and wants the best for the players. It was the right thing to do, but it was hard to leave camp.I have obviously gone through good and bad days, she says. I know everyone says they learn about their body, but probably last week at England camp I’d have powered through and not said anything.But actually it’s what is best for my body. It’s been tough. You look at the start of the season, I did my ankle ligaments from a tackle I couldn’t prevent. But I think it is just about staying in it.My dad has been there for me. He has been through it as he used to play football.My love for football and getting back on the pitch is so mentally driven. That’s my aim every time something happens. Playing for Arsenal or trying to get back in the England squad is just my aim every time.You can’t always expect football to be an easy ride and I think my main thing is probably learning from past experiences.Jordan has been playing exceptionally for Arsenal in recent weeks, after some weeks on the bench at the start of the season.  She was rightly rewarded with Player of the Match in Arsenal’s 3-1 defeat of West Ham in the WSL, as well as in Arsenal’s 3-1 defeat of Zurich in the Champions League.It certainly sounds like our Jordan has taken the necessary time to recover and is raring to get back on the pitch for Arsenal’s clash with Manchester United on Saturday!  Welcome back Jordan!Hopefully Nobbs will be Player of the Match again in another 3-1 win!See our Form Guide for Arsenal v Man Utd Women on Saturday.Michelle MaxwellFollow Michelle on Just Gooner Women on Twitter for regular updates on the Arsenal Women’s Team!Do you want to read more about the Arsenal Women’s Team? Click here….",[]
67,"Arsenal Women boss Eidevall confirms return of Williamson & Souza, ready for Everton clash",Just Arsenal News,Michelle,2022-12-02,https://www.justarsenal.com/arsenal-women-boss-eidevall-confirms-return-of-williamson-souza-ready-for-everton-clash/325000,"Arsenal Women boss Eidevall confirms return of Leah Williamson & Rafaelle Souza, ready for Everton clash By MichelleJonas Eidevall held his pre-match press conference today ahead of Arsenal’s WSL match against Everton on Saturday at Meadow Park, kick-off 2pm UK.Arsenal have been devastated by injuries over recent weeks, Eidevall being reduced to a choice of 15 first team players after Beth Mead’s ACL injury.  Eidevall discussed player returns from injury, with some very exciting news!Good news on the injury front?Yeah, it’s been good.  We have Leah and Rafa, who are able to go back into the matchday squad here tomorrow, so that’s obviously pleasing for us.  We’re starting to get players back from injuries and improving numbers again in the squad, so looking forward to that.Will Leah and Rafa will both start tomorrow?They’re in the matchday squad.  So starting XI, everyone will know tomorrow. How much of a boost does their return have on the squad?When I see us practice and these two players come into our environment, I think it helps us a lot because we get two more players of very high quality into our environment, into our way of playing and of course that will boost any team and it certainly does for us.Have the pair’s leadership qualities changed the squad dynamic?I think when you see a player like Leah coming into the environment, you can definitely see what qualities she will bring both on and off the ball and with her leadership. Absolutely. It’s the same with Rafa – it’s two quality players.Rafaelle Souza suffered from an injury to a metatarsal bone in her foot in early October, when Arsenal beat Ajax 1-2 securing their place in the UEFA Champions League group stage.Rafaelle, captain of the Brazilian Women’s squad also had to withdraw from international duties.  Leah went down with a similar injury shortly after Rafaelle, also being forced to withdraw from the England Women’s squad, of which she is captain.Both players have been sorely missed over the last two months.  Jonas’ announcement on their return to the matchday squad is music to our ears!When asked about Lina Hurtig’s return, Jonas said She’s progressing well just like Kim Little is, but they’re not ready to be in a matchday squad. She’ll hopefully return before Christmas which is great news for the attacking frontline choices..Interview & photo courtesy of Arsenal.It definitely sounds like there’s light at the end of the tunnel on Arsenal’s injury woes..We can’t wait for tomorrow’s match against Everton.  It will be great to see these two super heroes back on the pitch, even if Jonas only re-introduces them on a piecemeal basis.How exciting is this news?Michelle MaxwellFollow Michelle on Just Gooner Women on Twitter for regular updates on the Arsenal Women’s Team!Do you want to read more about the Arsenal Women’s Team? Click here….Your email address will not be published. Required fields are marked *Comment Name * Email *  

 Notify me of follow-up comments by email. Notify me of new posts by email.This site uses Akismet to reduce spam. Learn how your comment data is processed.",[]
68,Eidevall happy with Arsenal Women’s improved efficiency in front of goal after beating Villa 4-1,Just Arsenal News,Michelle,2022-12-12,https://www.justarsenal.com/eidevall-happy-with-arsenal-womens-improved-efficiency-in-front-of-goal-after-beating-villa-4-1/325676,"Eidevall happy with Arsenal Women’s improved efficiency in front of goal after beating Villa 4-1 by MichelleArsenal boss Jonas Eidevall reflected on our Gunners comeback against Aston Villa at Villa Park, in Arsenal’s 200th match in the Barclays Women’s Super League, after Arsenal came back from 1-0 down to achieve a 4-1 win, with goals from Corsie (Villa own goal), Miedema, McCabe & Nobbs.See full Match Report and Match Highlights.Speaking after the game, Eidevall credited Arsenal’s composure after falling behind in the opening minutes of the game and our improved efficiency in front of goal saying:I’m happy that we stayed composed and patient when we went one goal behind. That’s always a difficult moment for any team but we managed that very well. We continued to create scoring opportunities. It was nice to see us put a few more of them away than we’ve done in recent games. So all in all, good.We knew this was going to be a difficult game and a lot of teams have a problem coming here to Villa Park, playing against a strong Aston Villa this year. So happy with the performance and it’s great to have three points.Speaking about Arsenal’s resilience to come back from one goal behind:I think so. Because one thing that is difficult at that moment is to not let the emotions take over. You want to correct things immediately and that can mean that you start stressing things, and you lose your formation, you lose your balance, and then maybe you get a counter-attack against you, and then there are two goals. Then all of a sudden, you have created a mountain to climb. But we took it step-by-step, so that was very good to see.on our improved efficiency in front of goal…And on our improved efficiency in front of goal after winning our last 2 games by a narrow margin of 1-0 he said:It’s good to see that we were a little bit more efficient in front of the goal. I know we have that quality, but it’s nice for the players to do that as well. And so that was good. And now we just need to recover, refresh and prepare for Lyon. That’s going to be a very exciting – but also difficult – match for us.Our Gunners don’t have a lot of time to rest as they prepare to welcome reigning champions Lyon to Emirates Stadium on Thursday 15th December, 8PM UK kick-off.  Tickets available here.  When asked if he was excited about Arsenal’s upcoming Champions League match Eidevall said:Very. I mean, huge game against Lyon. It’s the European champions to come here to London at Emirates. Be there, be there to support us. We need that. We need to create a great atmosphere at the Emirates. We need to fight for every second of it and if we do and if we do our very best, maybe we can achieve qualification.Interview courtesy of Arsenal.After Lyon on Thursday, Arsenal then head to Zurich on 21st December for their final match of the Champions League group stages before going into the winter break.So our Gunners have moved up to 2nd in the WSL table and are currently top of Group C in their Champions League campaign.  Hopefully they can round off these last 2 group games, knowing they’ve qualified for the UEFA Women’s Champions League.  That would be a great Xmas present for everyone!Michelle MaxwellFollow Michelle on Just Gooner Women on Twitter for regular updates on the Arsenal Women’s Team!Do you want to read more about the Arsenal Women’s Team? Click here…. Your email address will not be published. Required fields are marked *Comment Name * Email *  

 Notify me of follow-up comments by email. Notify me of new posts by email.This site uses Akismet to reduce spam. Learn how your comment data is processed.",[]
69,WSL: Liverpool finally win after weeks of building as West Ham's weaknesses are exposed,ESPN,Sophie Lawson,2022-12-04,https://www.espn.com/soccer/english-womens-super-league/story/4825386/wsl-liverpool-deserved-win-exposes-west-ham-weaknesses,"Gab Marcotti and Craig Burley praise Olivier Giroud after he became France's all-time top men's scorer. (2:17)BIRKENHEAD, England -- Liverpool move up to ninth in the Women's Super League with their first win of the season since opening day, a 2-0 win over West Ham on a wintery Sunday afternoon on The Wirral.A miscommunication between West Ham midfielders Kate Longhurst and Honoka Hayashi gifted Liverpool's Ceri Holland an early goal when she picked up the ball after the pair had gotten in each other's way in the box. Under little pressure, Holland let a shot fly into the far side of goalkeeper Mackenzie Arnold's goal in the third minute.Struggling without the ball, the Hammers continued to tangle themselves into knots at the back and were soon chasing a two-goal deficit after Liverpool's Katie Stengel claimed her ninth goal of the season with a low strike in the 20 minute.Despite second half adjustments that both strengthened their defence and helped their attack get into the game, West Ham failed to get the better of Liverpool goalkeeper Rachael Laws with the ball travelling from one end of the pitch to the other without another goal scored.The second half marked with multiple stoppages for injuries resulting from chippy fouls, taking all the flow out of the match for both.JUMP TO: Player ratings | Best/worst performers | Highlights & key moments | Post-game quotes |  Upcoming fixturesSince shocking Chelsea on the first day of the season, Liverpool have repeatedly found themselves coming away from matches without anything to show for their 90 minutes of work.Yet, much like the truncated 2019-20 season that saw them relegated on points per game, the Reds have rarely been completely played off the pitch but rather have failed to convert, leaving them chasing games.But with two 3-3 draws in their last two league outings against fellow WSL stragglers Reading and Brighton, there was the growing sense that Liverpool were building towards that all important second win. Indeed, in their penultimate league outing of the calendar year, the Reds finally added their second three-point haul.It was by no means a fluke for the hosts either, but rather a collective effort to keep the ball from Laws' goal whilst getting forward to punish the less-than settled Irons' defence.Without the injured Lucy Parker and opting to start without Hawa Cissoko following her five-match ban, the West Ham defence continued to look weakened for their absences. And for all Liverpool were doing right in attack, there were clear question marks over the strength and understanding of the Irons' backline.The wider problem for West Ham wasn't just the utilisation of Kate Longhurst at centre-back, where she looked out of her depth over the first half, but the apparent lack of communication across the defence. Having lost former captain and centre-back stalwart Gilly Flaherty to Liverpool over the summer, it was clear that the team were lacking not just her experience but her vocality in the box to marshal the backline and repel attacks through understanding and teamwork.Indeed, when Cissoko was subbed on at the break, the defence looked far more comfortable in dealing with what Liverpool had to throw at them, which seemed to galvanise the entire team and allow them to get forward with more ease in the second half.With no specified timeline for Parker's return and the winter transfer window on the horizon, an experienced centre-back would be a sensible investment rather than manager Paul Konchesky trying to convert another midfielder.The defensive problems for West Ham spoke to the wider issue for the Irons -- the team is looking increasingly like a group of players thrown onto the pitch after names drawn from a hat rather than a team put together with partnerships allowed to bloom. Starting the weekend in fifth place in the league, having won four of their eight games this season, instead of growing as the campaign has gone on, the team have looked less and less assured as the weeks go by.Usually, a key player in terms of dictating attacks and popping up with a crucial goal or two, captain Dagný Brynjarsdóttir was kept quiet at Prenton Park and not allowed to orchestrate, highlighting how often the team relies on her inspiration.- World Cup 2022: News and features | Schedule 
- Stream on ESPN+: LaLiga, Bundesliga and more (US)Unless things change over the winter with the team managing to find more harmony on the pitch rather than relying on moments of individual quality, it's easy to imagine this West Ham team getting sucked down to the wrong end of the table.For Liverpool, who've stayed the course despite not getting the results, this win should be easy to build on with a clash against Leicester City, still pointless after nine games, and give the Reds a further boost ahead of the new year. However, if Liverpool fall back into the patterns they've displayed this season, they may continue to stay closer to the bottom of the pack than they'd like rather than breaking into the meaty middle of the table.The good news for both teams that the shortcomings of those around them are far greater than their own and they will both have more six-point games to play in 2023, allowing this to be more a season of growth and development to set them up for the following seasons, if they have the foresight and patience, that is.Liverpool: Laws 6, Koivisto 7, Hinds 6, Flaherty 6, Matthews 6, Campbell 7, Fahey 7, Stengel 7, van de Sanden 6, Holland 7, Lawley 6Subs: Kearns 6, Daniëls 6, Roberts 5West Ham: Arnold 5, Shimizu 5, Fisk 4, Stringer 5, Brynjarsdóttir 5, Evans 5, Asseyi 5, Atkinson 4, Hayashi 5, Longhurst 4, Smith 5Subs: Cissoko 6, Kyvåg 6The 24-year-old midfielder scored the opening goal and remained involved throughout. Not usually a centre-back -- she's typically a midfielder or wing-back -- she was a fish out of water in the heart of the West Ham defence.It didn't take long for Liverpool to get on the front foot: in just the third minute, Ceri Holland pounced on an unforgivable unforced error to put the Reds ahead over West Ham.As it turned out, that early goal was an omen for how West Ham's defence would look and how the match would ultimately finish.All we need is, Ceri Holland 🎶The goal that has us in front in #LIVWHU 🙌⚽Liverpool manager Matt Beard on whether it was a relief finally getting that second win of the season: ""A little bit, three points was important after the results yesterday but we've been performing okay, it's the inconsistency that was our most consistent performance from start to finish, it reminded me a little bit of the first game against Chelsea but just on the flip: we started fast, done really well got in front, saw the first half out, had to make two or three tactical changes to adapt to what they done but I just felt we dealt with everything really well today and it's a big three points and another step in the right direction""Beard on not conceding: ""I think the clean sheet was important and I think psychologically that will be good for us and especially how direct they were in the last 15-20 minutes to deal with everything that was thrown at us, I was really, really pleased.""Liverpool: The Reds get one week off before they again player host on Sunday, this time to Leicester on Dec. 11, at 9 a.m. ET.West Ham United: The Hammers continued their away stretch and they visit Tottenham on Sunday, Dec. 11 at 9 a.m. ET.","[""A little bit, three points was important after the results yesterday but we've been performing okay, it's the inconsistency that was our most consistent performance from start to finish, it reminded me a little bit of the first game against Chelsea but just on the flip: we started fast, done really well got in front, saw the first half out, had to make two or three tactical changes to adapt to what they done but I just felt we dealt with everything really well today and it's a big three points and another step in the right direction"", 'I think the clean sheet was important and I think psychologically that will be good for us and especially how direct they were in the last 15-20 minutes to deal with everything that was thrown at us, I was really, really pleased.']"
70,"Everton News: U18’s win, Amokachi remembers, Tyrer update and World Cup How to Watch",SB Nation,Peter Creer,2022-12-06,https://royalbluemersey.sbnation.com/2022/12/6/23494000/everton-news-under-18s-win-amokachi-tyrer-world-cup-how-to-watch-morocco-spain-portugal-switzerland,"We use cookies and other tracking technologies to improve your browsing experience on our site, show personalized content and targeted ads, analyze site traffic, and understand where our audiences come from. To learn more or opt-out, read our Cookie Policy. Please also read our Privacy Notice and Terms of Use, which became effective December 20, 2019.By choosing I Accept, you consent to our use of cookies and other tracking technologies.Filed under:It’s Day 17 of the FIFA World Cup, here’s all the viewing info you need and the best of Everton FC NewsWelcome to Day 17 of the 2022 World Cup! With Premier League action halted for the global showcase, we’re going to pivot to covering the World Cup for the next month or so, with an Everton focus. The Blues are on their tour to Australia so we’ll continue with coverage on that, but we’re also going to have all the viewing information you will need for the tournament in Qatar on a daily basis, with in-depth coverage on some teams of interest.A great review of the England win over Senegal by our very own Trent Nelson. [RBM]Everton Women fall to narrow defeat. [RBM]The Everton Stadium continues to grow on the banks of the Royal Blue Mersey! Check out the video which shows the first sections of roofing being added. [EFC]The Blues will host Arsenal at Goodison Park on Saturday 4 February, but now at the slightly earlier kick-off time of 12.30pm (GMT) and will be shown live on BT Sport. Later in the month, the Merseyside derby between Everton and Liverpool at Anfield will take place on Monday 13 February, with kick-off set for 8pm (GMT), a game that will be broadcast live on Sky Sports.Check out the highlights as the Everton Under-18’s battered the Rams from Derby. [EFC]An update on the progress of goalkeeper Harry Tyrer who is out on loan with Chester. [Echo]Leon Osman opens up on his very disappointing departure from Everton after the sacking of Roberto Martinez:“It is what it is. That is football and life goes on and football goes on. Regardless, we still love our teams and to support our teams home and away.” [Echo]No confronto entre #Inglaterra e #Senegal, válido pelas oitavas de finais da Copa do Mundo 2022, #Pickford fez um “milagre” e impediu que os senegaleses abrissem o placarhttps://t.co/ILTRHNTiXxTranslation: In the clash between #England and #Senegal , valid for the round of 16 of the 2022 World Cup, #Pickford performed a “miracle” and prevented the Senegalese from opening the scoring.Former Manchester City player Janine Beckie is attracting interest from Women’s Super League (WSL) rivals Everton [Manchester World]Another entry in the Liverpool Echo’s series on Everton players at the World Cup. Today it is Daniel Amokachi. [Echo]The final two quarter final matches take place today.Date and start time: Tuesday, December 6th at 7:00 a.m. PT / 10:00 a.m ET / 1:00 p.m. GMTDate and start time: Tuesday, December 6th at 11:00 a.m. PT / 2:00 p.m ET / 7:00 p.m. GMTFor more information on how to watch/listen to today’s action, check out your region’s streaming/listening options at LiveSoccerTV.com* 21+ (19+ CA-ONT) (18+ NH/WY). AZ, CO, CT, IL, IN, IA, KS, LA, (select parishes), MD, MI, NH, NJ, NY, OR, PA, TN, VA, WV, WY, CA-ONT only.Eligibility restrictions apply. Terms at draftkings.com/sportsbook. Gambling problem? Call 1-800-GAMBLER. Odds & lines subject to change.",[]
