,Headlines,Source,Author,Date,Link,Content,Quotes
0,Women’s Super League: talking points from the weekend’s action,The Guardian,"Suzanne Wrack, Sophie Downey and Sarah Rendell",2022-11-21,https://www.theguardian.com/football/2022/nov/21/womens-super-league-talking-points-from-the-weekends-action,"Arsenal’s winning run was ended in dramatic style at the Emirates while Brighton and Liverpool also produced a thrillerManchester United’s second win against one of Arsenal, Chelsea and Manchester City, and first away win against any of the traditional top three, was significant. The 3-2 defeat of Arsenal at the Emirates spoke to a real shift in the resilience of Marc Skinner’s side. Having taken the lead, United’s collapse early in the second half, conceding twice, looked to be following a familiar pattern. Instead, in front of an impressive away end, United roared back to equalise and then win it in injury time. Skinner called it a full Manchester United performance. “Our job is to bring the women under that same banner of: we might go down but we’re never beaten,” he said. They were helped by some poor defending for Katie Zelem’s lethal set-pieces, which provided goals two and three, but there is little doubt that United, after a bruising 3-1 defeat to Chelsea, are serious contenders. SWWhat a way to get your first #BarclaysWSL goal!@ArsenalWFC 🙌 pic.twitter.com/wgHYEVHZbsPerhaps the biggest winners following Manchester United’s 3-2 defeat of Arsenal were Chelsea. Having beaten United 3-1 before the international break, the Blues pounced on the opportunity to go top of the table, albeit with an extra game played, with a 3-0 home win over Tottenham. Emma Hayes returned to the touchline following her emergency hysterectomy, but the team had gone unbeaten in her absence and, in many ways, transition in and out had been seamless. “There is often this sense that coaching has to be done from coaches to players,” she mused after. “Instead I want players to be coaches on the pitch. So Sam Kerr said to me that when she scored against Manchester United the other day – when her touch had been all over the place in maybe three or four subsequent moves –just before that Guro [Reiten] had told her ‘Sam, the next time the ball comes, turn and shoot.’ It just made me feel so confident.” SWStill thinking about this strike from @erincuthbert_ 🤩#BarclaysWSL @ChelseaFCW pic.twitter.com/gXLsKiRmatIf you are looking for pure drama, a Brighton game is the place to be these days. A fortnight ago, they had clung on to victory in a nine-goal thriller. On Sunday, they surrendered a lead once more, leaving interim manager, Amy Merricks, lamenting her side’s tendency to concede. It was deja-vu as the Seagulls found themselves 3-1 up at the break. A capitulation followed, however, as Liverpool produced an inspired comeback. Despite a tough run of form, Matt Beard’s side have shown character and they took their opportunities with Shanice van de Sanden as the catalyst. The substitute pulled one back before providing the assist for a dramatic equaliser. Rachel Furness was the player of the hour, bravely diving in with her head – as she so often does – at a cross in the 91st minute to send her team home with a valuable point. SDLiverpool equalise in extra-time 👀 What a goal from @RachelFurness10 🚀 #BarclaysWSL @LiverpoolFCW pic.twitter.com/Sy1lFLwvnnWhen your luck is out in football, it really is out. An 87th-minute winner from West Ham’s Izzy Atkinson – her first goal for the club – struck a dagger through Leicester hearts. Having what looked an equaliser disallowed minutes later only added to the pain. The Foxes, propping up the table, produced a solid performance on Sunday against an out-of-sorts West Ham. For the most part, they were brave and compact, controlling possession and tenacious with it. Their inability to convert chances, however, made them pay once more. Before the game, Willie Kirk’s side had the lowest shot conversion rate in the league at 3.5% and that problem was highlighted in this encounter: they created 17 shots to West Ham’s eight but only managed three on target. Kirk was keen to emphasise the positives post-match but he will know how valuable even a point would have been. With Chelsea next things do not get any easier for this Leicester side as they try to find a way to turn their fortunes around. SDSign up to Moving the GoalpostsInformative, passionate, entertaining. Sign up to our weekly round-up of women’s football now.The composure from @izzyatkinson_ 🧊#BarclaysWSL @westhamwomen pic.twitter.com/YUY3MyYNaeReading have had a difficult start to the season and are second from bottom. On Sunday, at Villa Park, they took the lead in the seventh minute but once again defensive errors let them down and they ended up losing 3-1. It went wrong late in the first half with Rachel Daly being left unmarked to head in the equaliser. True, it was a superb header but she had far too much room to execute it. Daly then made it 2-1 from a corner and it could even have been 3-1 early in the second half but Kirsty Hanson missed a glorious oppotunity. The Reading goalkeeper, Jacqueline Burns, was then sent off for a challenge on Daly and the England international completed her hat-trick from the spot. Reading have conceded 17 goals in seven games; that ratio needs to improve if they are to avoid a relegation scrap. SRThe composure from @izzyatkinson_ 🧊#BarclaysWSL @westhamwomen pic.twitter.com/YUY3MyYNaeStriker Khadija ‘Bunny’ Shaw has become the linchpin of Manchester City’s team this season and scored another vital goal at the weekend, this one giving her side a 2-1 win at Everton. The goal, coming in the 49th minute from a rebound, was her eighth in the league this season and handed City their fifth consecutive WSL victory, ensuring they keep the pressure up on the top three. Shaw set up the other goal for her side but the City manager, Gareth Taylor, was at pains to point out her overall contribution. “She does so much more than score goals, the way she takes the hits as well as giving the hits out,” he told the BBC. “She’s also very strong and she’s looking a lot fitter. She’s found a rhythm now in knowing she’s the focal point of the team.” SR",[]
1,Moving the Goalposts | ‘We want to keep dreaming’ – the rise and rise of Roma Women,The Guardian,Sophie Downey,2022-12-07,https://www.theguardian.com/football/2022/dec/07/we-want-to-keep-dreaming-the-rise-and-rise-of-roma-women,"Club has soared since acquiring the Serie A licence from Res Roma in 2018 – and is now targeting European successWelcome to Moving the Goalposts, the Guardian’s free women’s football newsletter. Here’s an extract from this week’s edition. To receive the full version once a week, just pop your email in below:“Un Pari Che Sa Di Gloria” read the headline of il Romanista a fortnight ago: “A draw which has the taste of glory”. Champions League debutants Roma had just held Wolfsburg, one of the European greats, to a draw at home. It was a result that put progression into the knockout stages firmly in the Giallorosse’s grasp, sending a signal around the continent that there is very much a new kid in town.Since acquiring the Serie A licence from Res Roma in 2018, Roma have made solid progress. Last season – Alessandro Spugna’s first in charge – they finished second and qualified for Europe for the first time. The ambition to be among the European elite is clear and their form has backed it up. Unbeaten in 15, they have leapt to the top of Serie A, leading Juventus by a comfortable six-point margin. They won the Coppa Italia in 2021 and that was followed by the Supercoppa Italia last month.“We are a very ambitious club, and we want to try to win as many titles as possible,” Spugna tells Moving the Goalposts. “We know that to do this we need to improve. We already managed to get one trophy this season, the Super Cup, to which we attached a great importance. We are doing very well in the Italian league … as far as the Champions League is concerned, this is a dream. We want to keep dreaming. It’s very hard but it allows you to get better because you have to measure yourself against very big teams.”Much of his side’s success has been down to the personnel acquired. The Giallorosse are an eclectic mix, blending some of Italy’s best with stars from abroad. The striker Valentina Giacinti arrived from Milan in the summer and has already made an impact. Rome has been home to Brazil’s centurion, Andressa, since 2019 while the experienced Austrian defender, Carina Wenninger, arrived on loan in the summer.“There has been great work since the foundation of this club,” Spugna says. “Every year, we’ve been adding bits. This is a club made up of ambitious people with a great desire to improve.”“The level has increased in Italy thanks to the advent of professional women’s teams. In the last two years, big international players landed in the Italian league and we are one of the clubs who have invested a lot in important players. The league continues to grow, but of course to get to the level of Lyon, Wolfsburg, Barcelona, Chelsea … it will still take time because they are ahead of us. We are trying to bridge this gap and I believe we are on the right track.”As the women’s game continues to develop, a historic club such as Roma having a notable women’s side is key. They are a team that like to play on the front foot, but their manager is pragmatic about his side’s approach: “I like a team that dominates teams,” he says. “Domestically, we are managing to do this because we have a lot of quality … that’s what we are also trying to do in the Champions League. But of course, at this level, which is much higher, it’s not always possible and sometimes you have to defend.”They are unbeaten in Europe this season, winning five of their seven matches. The highlight was that confidence-inducing draw with Wolfsburg, who they meet again on Thursday evening. “It meant a lot to us,” reflects Spugna. “Not only because of the final score, but because of the performance. We were brave on the pitch. We not only defended the result, but we tried to win the game.”The pride Spugna feels is evident. However, he is not one to rest on his laurels with a clear focus to push Roma to the next level. “I landed in this big club and city, living a dream,” he says. “But now I’m here, I’m very happy and very proud. I’m happy that we’re doing good work, which is the most important thing. You need to keep doing this because in football, you need to forget what you did yesterday, and you need to focus on the future.”All change in Canada Legends of the game Christine Sinclair and Diane Matheson have announced the formation of a first professional domestic league in Canada. Project 8, co-founded by Matheson alongside Thomas Gilbert, intend for its inaugural campaign to start in 2025. It will be composed of eight teams, spanning the country. Vancouver Whitecaps FC and Calgary Foothills Soccer Club have been revealed as the first two founding members.Frappart’s debut History was written last week as France’s Stéphanie Frappart became the first woman to referee at a men’s World Cup. She was the official in the centre of the action as Germany took on Costa Rica in the group stages. Her two assistants, Neuza Back and Karen Diaz Medina, joined her to make up the first all-female trio in charge, marking a significant step forward in the field.Sign up to Moving the GoalpostsInformative, passionate, entertaining. Sign up to our weekly round-up of women’s football now.All eyes on Manchester There was a new record attendance for Manchester United on Saturday. More than 30,000 supporters turned out at Old Trafford to enjoy their side’s thumping win over Aston Villa. All eyes will be on Manchester again next weekend. Over 40,000 tickets have been sold for the highly anticipated Manchester derby at the Etihad. With both sides in good form and mounting a title chase, could it be a significant game for the direction of the WSL?The Theatre of Dreams has seen many a special goal in its time. Another was added to the list on Saturday as Ona Batlle brought the flair to Old Trafford in Manchester United’s 5-0 victory. Her thunderous effort from close range went in off the crossbar, giving Hannah Hampton no chance in the Aston Villa goal.“One thing that is clear is that you have to have some time off in football. That is important for any job, even if you love your job and it’s your passion and it’s what you want to do … it’s a deeply human thing where you need to switch off and reconnect …that is important in any workplace, and we need to acknowledge that” – Arsenal’s Jonas Eidevall on the importance of giving his players time off.Got a question for our writers – or want to suggest a topic to cover? Get in touch by emailing moving.goalposts@theguardian.com.",[]
2,Leicester’s Ashleigh Plumptre: ‘I love everything about being in Nigeria’,The Guardian,Ella Braidwood,2022-11-17,https://www.theguardian.com/football/2022/nov/17/leicester-ashleigh-plumptre-nigeria,"The defender on playing for the club in her heart and learning of her heritage through representing the country of her grandfatherRight to her core, Ashleigh Plumptre is a Leicester City player. Growing up in Melton Mowbray, about a 30 minutes’ drive from the city, the 24-year-old defender played for the club’s centre of excellence from the age of eight to 14, having started playing a few years earlier for a local girls’ side.“I was one of those kids that just always wanted to be active,” Plumptre says. She recalls getting home from school, dropping off her bags before playing football outside until “my mum would say I had to be home for dinner”.As a teenager she temporarily left her hometown club, where she would later sign her first professional contract. As Leicester’s senior women were relegated from the third tier in 2013, Plumptre was tempted by Birmingham, a founding member of the Women’s Super League, where she joined their under-17 squad. After that followed a brief period at Derby, before she joined Notts County, who were then a WSL side.In 2016, Plumptre moved to the US on a scholarship at the University of Southern California, where she majored in human biology. Her college side won the National Championship that year and were invited to the White House. Of that time, she says: “It influenced so many things in my life, and not just football, I found out more about myself, what I’m passionate about.”But her ambitions never strayed far from returning to Leicester. By this point, the club had risen through the ranks to the Championship. After graduating in 2019 and despite interest from a few WSL sides, Plumptre was set on Leicester. Her father, also her agent, approached the club directly. The deal she signed has since extended it until at least next June.“[It] meant a lot to me to sign for Leicester because it was the club I’ve always supported and I grew up here,” she says. “I felt valued here, and I felt like I had a purpose here in trying to bring success to the club.”After joining, Plumptre played a key role in securing Leicester’s promotion to the WSL for the 2021-22 season. Money likely helped, too: her team went fully professional in August 2020, after it was bought by King Power. “All the investment … it showed in the players that we brought in, and [promotion] was everybody’s mindset from the beginning,” she says.Football, though, is far more than just a sport to Plumptre. “I have to have a purpose in it,” she says. “I struggle just to play it.” Case in point: she is an ambassador for Menphys, a local charity supporting young people with disabilities, which has supported her brother, who is autistic. (Plumptre has two younger brothers and a sister, all half-siblings.)It was also in this mindset that, during the coronavirus lockdowns, Plumptre began thinking more about her Nigerian heritage: her paternal grandfather was born in Lagos.Soon, she was talking to her 12-year-old sister about it. “Even though we have the same dad, we both have a Nigerian dad and a white mum, she looks a little different to me and has experienced things in school that I never had,” she says. “Most people just assume that I’m white. I identify as being mixed heritage. But my sister … she identifies as being black.”“I felt a bit helpless in that,” she says of learning about her sister’s experiences. Plumptre had played for England’s youth squads, including at Under-23 level but this year switched her allegiance to Nigeria, making her official debut in February. She says: “That’s where I’m like: ‘OK, Nigeria would be good for me to do because then I can experience the culture more, I can come back and teach her about our heritage.’ That was the trigger for me.”Sign up to Moving the GoalpostsInformative, passionate, entertaining. Sign up to our weekly round-up of women’s football now.Having not visited Nigeria until last year, Plumptre has embraced playing for the west African country. “I love the culture, I honestly love everything about being in Nigeria,” she says. She has also “realised how lucky I’ve been to just have been born in this country, the opportunities that I’ve been blessed with”. She adds: “My Nigerian teammates, for example, they’ve worked so hard but sometimes they don’t get the same opportunities based upon the teams that they’re playing in, the lack of exposure that they have. It’s a privilege to play with them.” Next year, she hopes to make the squad to represent Nigeria at the World Cup.Back at Leicester, Plumptre faces a turbulent season ahead. With her side having lost their first seven matches, a relegation battle looks likely. But after fighting off the drop last season, she’s hopeful. “We know how it feels and we know how to get out of it so ultimately everybody is pretty much keeping the faith,” she says. “We know we can get results.”What else does she want to achieve? “I just want to have an impact by being myself, I don’t really know what that looks like yet,” she says. “I want to help people, that’s all.”Get to know the players in England’s top flight better with our WSL player in focus series. Read all our interviews here.",[]
3,Man City win keeps pressure on WSL top three,BBC News,,2022-12-04,https://www.bbc.co.uk/sport/football/63771047,"Last updated on 4 December 20224 December 2022.From the section Women's FootballManchester City kept up the pressure on the top three in the Women's Super League with a comfortable home win over Brighton.All three goals for the hosts came inside the first 26 minutes as Gareth Taylor's fourth-placed side made a blistering start at the Academy Stadium.City were imperious in the first half with England forward Chloe Kelly at the heart of everything.Kelly's in-swinging corner led to the opening goal as Brighton goalkeeper Megan Walsh fumbled a regulation take and the ball went in off Seagulls' midfielder Veatriki Sarri in the 11th minute.Julie Blakstad doubled the lead eight minutes later with a superb diving header to divert Kelly's left-footed cross-cum-shot into the bottom corner.Then, with Brighton reeling, Laura Coombs added a third on 26 minutes with a fierce strike from 20 yards out that gave Walsh no chance.City could have added to their lead before the break and would have done were it not for a fine save from Walsh to deny Coombs in stoppage time, while Deyna Castellanos hit the post early in the second half.Brighton were much improved after the restart, though, and were rewarded for their efforts by Lee Geum-min's scrambled consolation in the final minute.Victory took City back to within three points of Manchester United and Arsenal in second and third place, while Brighton drop to second bottom.It is highly likely Lionesses forward Kelly has already lived the moment for which she will most be remembered.Scoring to win England the Euros in extra-time at Wembley really was the stuff of dreams.But at 24, Kelly has time to create many more memorable moments and, on this showing, you expect they won't be too far away.Super sub in that famous triumph against Germany, everything she did against Brighton suggests Kelly can shine further on the international stage.You had to feel for Brighton left-back Poppy Pattinson with the way Kelly seemed to toy with her throughout the opening half, cutting inside one minute before bursting past her on the outside the next.One particular jinking run early in the game had Pattinson in such a tangle it was impressive she even managed to stay on her feet.With the game won, Kelly was withdrawn on the hour mark, but still created seven chances in the game - four more than anyone else.She might not have been able to cap her performance with a goal but she was the creator supreme, both for herself and others.Formation  4-3-3Formation  4-4-2Match ends, Manchester City Women 3, Brighton and Hove Albion Women 1.Second Half ends, Manchester City Women 3, Brighton and Hove Albion Women 1.Goal!  Manchester City Women 3, Brighton and Hove Albion Women 1. Lee Geum-Min (Brighton and Hove Albion Women) left footed shot from very close range to the centre of the goal    following a set piece situation.Lee Geum-Min (Brighton and Hove Albion Women) hits the right post with a right footed shot from the centre of the box. Assisted by Poppy Pattinson following a set piece situation.Esme Morgan (Manchester City Women) is shown the yellow card for a bad foul.Foul by Esme Morgan (Manchester City Women).Katie Robinson (Brighton and Hove Albion Women) wins a free kick in the attacking half.Corner,  Manchester City Women. Conceded by Poppy Pattinson.Attempt blocked. Esme Morgan (Manchester City Women) right footed shot from outside the box is blocked.Attempt blocked. Filippa Angeldahl (Manchester City Women) left footed shot from the centre of the box is blocked. Assisted by Hayley Raso with a headed pass.Attempt missed. Julie Blakstad (Manchester City Women) left footed shot from very close range is too high. Assisted by Hayley Raso.Attempt missed. Hayley Raso (Manchester City Women) right footed shot from the right side of the box is close, but misses to the left. Assisted by Esme Morgan with a headed pass.Substitution, Brighton and Hove Albion Women. Libby Bance replaces Veatriki Sarri.Foul by Ruby Mace (Manchester City Women).Megan Connolly (Brighton and Hove Albion Women) wins a free kick in the defensive half.Attempt saved. Khadija Shaw (Manchester City Women) header from very close range is saved in the centre of the goal. Assisted by Hayley Raso with a cross.Corner,  Brighton and Hove Albion Women. Conceded by Alex Greenwood.Foul by Ruby Mace (Manchester City Women).Lee Geum-Min (Brighton and Hove Albion Women) wins a free kick in the defensive half.Substitution, Manchester City Women. Ruby Mace replaces Deyna Castellanos.Match of the Day: Top 10 ranks the best of the bestThey sat down for a revelatory chat during the rock star's whirlwind tourMouth-watering recipes which will make everyone happy regardless of the result on the pitch    Watch all of Lionel Messi's World Cup goals so far as he prepares to lead Argentina against Croatia in the semi-finals at Qatar 2022.There may be an air of disappointment after England's World Cup exit but here is why fans of the Three Lions have reason to feel optimistic.See every card from Argentina's intense quarter-final match with the Netherlands, which set a World Cup record of 18 yellow cards shown in a single match.   ",[]
